reviewId,userName,content,score,thumbsUpCount,reviewCreatedVersion,at,appVersion
4962a36b-f811-4b53-b68c-69d63d894d62,Arya Rewardhana Mahendra,Why cant this app activated for car and motorcycle in the same cell number? Im sure the dev team can came up with something.. it was way much more user friendly when shell used card membership,1,1,1.0.6,2022-10-09 18:52:29,1.0.6
d55dfba4-f08a-4cde-b58e-96670a947bea,Johnathan Tan,Can't even register. Asked to reset BonusLink pin and the OTP never comes. Useless.,1,0,1.1.1,2023-10-03 12:20:45,1.1.1
d5bec31f-aeb7-465f-81a6-23c615d57c7f,Lawrence Chong,Dont bother to pump at shell as tge vouchers are only avalible after you top up X amount. There's other better options than this scammer...,1,4,1.1.0,2023-06-12 17:34:07,1.1.0
eb536a0b-98c2-4df4-80f5-bebd6b6ef640,Jasper Phua,"Compare to ESSO app, Shell app is really badly represented. Can't link to my card and dunno what is the benefits to link too. Really bad app.",1,2,1.0.7,2023-01-03 19:20:17,1.0.7
e70d6152-0bff-47dd-b591-f5f5762b267b,Ravi Sh,"This app made me not to visit shell again, this shows their loyalty. Cheating people giving false promise saying points will be added by doing gimmick of scanning, which never happens",1,0,,2021-02-17 01:28:54,
ba782dde-f862-4ccb-aab9-b3671af5c702,Sandy Ong,"Very lousy. The otp is not even working. Entered countless time waited for 30mins and retry still not working, received nothing.",1,3,1.0.7,2022-12-28 14:16:42,1.0.7
7b7edddf-4622-492a-a54c-76f1c107833c,Turtly Blahaj,Unable to even choose a country,1,0,1.2.0,2024-01-01 01:01:14,1.2.0
dc50e623-6958-4849-a84d-4fa171228bb1,Michael Ong Eng Hui,Junk App. Cannot register an account,1,0,1.1.2,2023-10-24 18:55:39,1.1.2
a88a97b5-08b1-4a84-9907-a0632af82a8e,DrKrishna Surgeon,"Not getting points after fuel purchase. What is the point of app when points are not added. Shell staff says only one thing, update the app. Time waste app.",1,41,1.0.1,2021-01-03 19:18:50,1.0.1
04257b7a-5440-4994-8930-107744a4a57a,andy ng,Why force to link bonus link card and especially cant change card no. Then cannot use at all,1,0,1.2.0,2023-11-13 16:16:07,1.2.0
03454031-20b9-4b15-82e6-276718a62c31,Ashish,Not working in infinix zero 30,1,0,1.1.2,2023-10-15 16:20:53,1.1.2
a54eb12f-d3b8-40ee-8e93-812b7ae2cacc,Hazmi Poisie Abdullah,Not functioning even already at shell station,1,0,1.2.0,2023-12-13 04:58:12,1.2.0
6e1cd4d0-ec42-4666-956c-9e57206b55bb,GaruzIT Fryer,cannot press key to keyin otp,1,0,1.1.2,2023-10-28 13:12:57,1.1.2
a0dd42b2-bcb2-43a4-b76f-ae4d16e121a7,Ir. Mohd Adha,Useless. Shell should benchmark Petronas Setel app. User-friendly,1,0,1.1.2,2023-10-30 16:46:48,1.1.2
fa6cd9b0-9abc-4cdb-a7ed-385871e91b7d,Huzaifa Najmi,Invoice cannot be downloaded. Asks for storage permission. But all permissions are already there,1,0,1.0.7,2023-02-07 11:33:12,1.0.7
563f18bb-1957-45a4-86ab-fa24806bfc63,Abdul,"Why need phone number verification upon registration? Wouldn't email be sufficient? Way to fish for information just to have you bombard later with ads and ""promotion""",1,2,1.0.7,2022-12-11 05:33:02,1.0.7
47a7fba8-633e-4dbe-bf1e-9f58955761f8,Stephen Liew,"AVOID. Typical useless app, adding inconveniences. Quicker to use your payment card directly at the fuel pump terminal.",1,2,1.1.1,2023-08-23 05:36:19,1.1.1
61f9ed06-cbe8-4e34-892d-6f64f45aaee8,Yogeswaran Balakrishnan,"We already saved our debit card (Mastercard). But each time when we need to fuel required OTP, which is taking more time. Only RM40, RM60, RM80 available. We required RM50.",1,2,1.1.1,2023-08-20 16:38:06,1.1.1
3c6a9818-d171-4b7d-b98d-e41ca8a02fff,Ali Suleiman Soud,after so many times trying but still cant receive OTP while registering. Am starting to doubt the app is not worth using.,1,0,1.0.7,2023-03-28 13:03:22,1.0.7
52356ea8-6d3d-43d1-9c66-d752c1fc086f,Aryan sindhi,"It is very useless but in the app it has been given that this product can be found, that product can be found but go when you want to radium by going there.",1,2,1.0.5(18),2022-01-07 15:54:19,1.0.5(18)
9a1702b3-386c-4927-b4e4-456d4e693091,Bintang Aldifa,"My account automatic logout, and sign with my phone nomber, code otp not come. I try again and again. Block for 30minute. This disgusting",1,7,1.0.7,2022-11-24 14:19:37,1.0.7
43987e35-0cd6-4a56-9269-088c49cf7aa9,Sherly Anne,"Can not login after update, its said my number not registered even i've input otp number's its not working 😔 lose my point. Fix this please...",1,0,1.0.7,2023-01-04 13:37:45,1.0.7
51785d40-296f-4dcb-9858-37db1c8fdd18,Kp Reddy,"Hey hi Sheller, a small feedback not able to register or sign in after installing, even re installation,,,,,, it's not helping please do work on these",1,0,1.0.7,2023-02-22 19:29:23,1.0.7
e2ca31cf-9b71-44d2-89d3-9a3355576926,cby2309,"Can't even migrate old card membership to app.. Prompting ""opps, something went wrong, please try again later"" 😂😂",1,2,1.0.7,2023-01-04 08:18:21,1.0.7
a6b435d9-a2f5-4a4d-9b76-71683313ba49,Hrishikesh CE,Can't you add the most basic features like fuel price ?? Also while downloading your transaction details not showing how much quantity of fuel... What is this!!!,1,0,1.0.6,2022-12-02 07:24:30,1.0.6
d8cf6eb4-eb5d-4e21-ab84-94d2b3073139,Ravindra Babu,Not able to register...only plus (+) in the name of your app but there is big minus(-) with it.useless app.,1,0,,2021-03-15 07:18:57,
3a3f80cf-e268-4ea2-9f60-8138639fc2ce,Arun Lamkhade,I am trying to login from 2 days. OTP has expiry of 15 minutes and I am getting OTP after 30 minutes or sevaral hours. Hats off to your QA and UAT team.😆😆,1,0,1.0.6,2022-06-20 11:55:45,1.0.6
82815e3b-1381-42f4-baea-a03951519306,Arvind Prabhu,"Logs me out frequently, if I switch to window to check on OTP it goes back to the launch screen, The old option of card or even a QR code will be good alternate",1,2,1.0.2,2021-04-12 11:38:56,1.0.2
25926e14-f60b-4527-b26a-3119aef6ae3c,TTG,Compulsory to link bonus link card which is i dont have bonus link card...well..i uninstall it within less than 5 minutes..back to setel app i guess..so thanks but no thanks,1,0,,2023-08-03 17:02:00,
426de8a6-9a42-48d6-bfe1-0dc612d2058d,Dushyant Mahida,"Very bad experience at bharuch G N Enterprise, Zadeshwar. They are not able to manage the traffic on their pump. I have filled petrol of 1500 INR and did not get rewards as they don't have go plus on that particular station point. Then j waited for 5-7 minutes at the parking and had to get out of car and went to their person who informed me give your number I will credit your rewards which is still not done. Needs to take immediate action otherwise there is no meaning of waiting in long lines",1,10,1.0.1,2021-03-12 22:43:27,1.0.1
6e2511ca-cc89-4b00-8bfa-2d752f319303,KS Lim,Still need to enter OTP every transaction... make the payment slow.. i believe Shell can do better then Petronas Setel..,1,0,1.1.0,2023-08-05 17:42:48,1.1.0
8b13420d-f187-4533-94c0-a7b019b53e77,ivan cheah,?can't even touch the registration or log in button? Keep showing pls enter ur country?where is the selection button ? boleh kah tak boleh?,1,0,1.1.0,2023-08-04 14:35:13,1.1.0
fb6611fb-481a-4fb9-a3dd-a5f6a8bda258,shreyas b (Mr mercenary),Fuel attendant fakes scan multiple times....app dosent have any notifier that says you tried to refuel for a such amount......honestly no point in having app....a total ripoff,1,0,1.0.2,2021-09-02 12:47:41,1.0.2
b73da704-dd29-48b1-85d9-5e475c7f15ca,M P,"After I update app, it is asking to sign in agai. It shows OTP sent but there is no any OTP received through this app..Very bad experience.",1,5,1.0.5(18),2021-12-16 19:45:46,1.0.5(18)
6fdeb25b-0d6c-47bd-9c46-67018c0b445b,Biolzable,No OTP generate. After 3 attempt to resend password have to wait for 30mins. But still no OTP. Terrible,1,2,1.0.7,2022-12-27 22:38:56,1.0.7
74faf936-554c-42e6-8269-654d23b57f9a,ARUN KUMAR .V,Application as well as service both are not as expected. Only thing why I prefer shell is bcoz of quality.,1,0,1.0.5(18),2022-03-09 06:28:11,1.0.5(18)
200a4897-5c31-4a97-994f-386f92236a05,Aulia Adlan,"You want us to use this app by the end of Feb 2022, but some stations dont use this app. How dissapointing!",1,0,1.0.5(18),2022-02-28 11:21:32,1.0.5(18)
eba255be-c05d-4434-b3f0-91428912ebca,Bijay Sharma,Not get rewards till yet. Petrol pump operator told you'll get rewards everytime when you use our products. But till now no rewards on my app,1,1,1.0.2,2021-08-13 11:50:20,1.0.2
3ad1624e-3538-40a1-8f7d-38e05d8ca75c,Pavan C,"Can't login in multiple devices! If you login in one, the other device logs you out",1,1,1.0.5(18),2022-02-13 17:03:34,1.0.5(18)
571f14e5-693a-401d-8b2c-ec069c43fe6b,Ramesh Navi,Least rewarding program. I don't think it's worth keeping app on phones. You need to buy 20L (2200rs) petrol to get 200 points which can only get one 500ml water bottle worth 10rs.,1,1,1.0.6,2022-09-28 08:30:24,1.0.6
6cb99936-b3ea-4be4-8d5c-20501ae3eaaf,Mustakim Najib,Can't sign in due to wrong bonuslink pin. Please disable bonus link sign in,1,0,,2024-01-02 04:13:31,
b86e8a4d-cde1-496c-9de7-623c25043a2d,Indra Sitompul,"-Cannot link clubsmart card with apps -In 2 month, 2 apps promo are invalid. Got no promo poin from completed transactions",1,1,1.0.6,2022-11-10 07:45:12,1.0.6
7dcd22e6-5c2d-4fed-93ae-2d8b7a36de90,Isfyandie Barji (GameSky),waste of time... need to filter which station support... and payment isn't smooth,1,0,1.1.1,2023-10-04 13:38:07,1.1.1
5daabd45-ef29-407c-85fd-eb275cac49a8,nurul hidayah,can't do anything after install.. can't click register or sign in.. uninstall after 2 min,1,0,1.1.1,2023-09-22 19:38:39,1.1.1
c48aae07-d8d8-4c31-ba92-9f63dccb620d,Ramlan Nik,Never able to make payment with this app. Setel is by far much easier to use,1,0,1.1.1,2023-09-25 04:57:20,1.1.1
46fa0355-0119-4fff-bae0-14d4f7273971,lika samuel,I cant even sign up. Keep asking me to choose country but the screen is blank. How to choose? Dont waste your time install this app,1,0,1.1.1,2023-10-05 08:11:58,1.1.1
2a5b4ddb-837a-4dc2-a032-5eb1aedeafd1,MOHAN KUMAR Y S,Can't redeem points for all the products which is available in shell select store..,1,0,1.1.1,2023-11-08 22:37:38,1.1.1
3ff8463a-50e4-4300-b62b-a725617b5f2d,Huzaifah Lasin,Worst app! Admin please terminate this unresponsive app. Waste time and efforts.,1,0,1.1.1,2023-10-03 17:10:12,1.1.1
5fbaff9d-aacc-479c-bc75-b5fdb6209d6b,Ahmed Alzakwani,"Very very bad and slow app. How can a company as big as Shell make an app like this?. If there's a rating of less than one star, I would gladly give it to this app",1,0,1.1.1,2023-10-07 13:02:22,1.1.1
613d0314-0203-485f-91ac-a861c76d0cd1,Krunal Pithwa,Unable to recive OTP on my phone. Tried many time to register. Please help to fix it.,1,1,1.0.5(18),2022-02-09 09:59:36,1.0.5(18)
10fc2780-2387-45e1-baa5-c53b3b3b505a,Kirim Artikel,"Could not link card to app, so we could not transfer our amount of past rewards to app!!!",1,0,1.0.5(18),2022-03-17 11:45:45,1.0.5(18)
2432d7bd-7abd-409f-b607-9bfeab2fd6ab,Raju Khadka,"Trying to get OTP to login but it's sending OTP after 5 hours, kindly fix this. I am unable to login",1,1,1.0.6,2022-06-29 17:09:41,1.0.6
40a7ad42-b756-4d52-8809-180c4b5e7bf8,kishor krishna,Very worst app ... While trying to register it's not accepting my first and last name .. it display enter valid name,1,0,1.0.1,2021-03-30 12:06:01,1.0.1
e7a157d2-5749-48f7-a110-1dd450a302b9,junaid shah,"The app is good but the ratio for points to benefit is very low. I mean if I fill petrol of Rs. 20000/- I get a benefit of Rs. 50/- ...that is literally nothing. No sense in membership, my credit card will give more benefit than this.",1,1,,2022-08-04 17:24:00,
2ed2329e-a7c3-4a1f-b106-34b384ba3731,Ram Charan,"This is horrible, no options in the app are working including transactions,help etc",1,0,1.0.2,2021-08-12 09:08:17,1.0.2
b8154f71-8e39-4c61-abb0-2655886bc1de,hardik bambhaniya,Many time i used this app at petrol pump.But never get any reward point.Also complain same there but there are not aware.So uninstall the app is best.,1,1,1.0.1,2021-03-19 22:19:13,1.0.1
41248480-aa2e-46a4-b46b-731a5edc2c70,Family Chan10,"Lousy, not user friendly on mobile user on particular input. Many rooms for improvement on this app.",1,0,,2023-01-14 06:42:52,
d2ef980f-abe9-4c67-afd5-46aeaba87b7b,Dushyant Kamani,Not able to register i tried many time but after vehicle selection not found any next option to complete registration.,1,3,1.0.2,2021-05-04 15:18:53,1.0.2
6b5ed2a1-0cc9-4840-975a-fac2d297aff5,ganesh gajini,Shell is Not available in all the cities. Though it is available but not in the near by location,1,0,1.0.2,2021-05-21 23:35:44,1.0.2
994f7ffb-de97-4310-9c0b-896485ce1f59,franklin franky,The point will not get added ....for full tank petrol of car ....just 20 points are added...dont waste ur Internet and memory in downloading this app,1,0,1.0.1,2021-04-03 00:27:24,1.0.1
c335d353-c779-4ffa-ab8a-262f4f1dedfc,Sigit B,"After last update, account log out automatically and cannot login back (no OTP received)",1,0,,2022-12-04 06:49:00,
fc29d372-052b-46b7-87ef-20f62dd5b6d9,sandeep p,"Your staff are least interested in scanning the qr, fuel pay and go is their mantra... When we ask for scanning common response is go to shell store... Or mail us... Useless app",1,1,1.0.2,2021-08-31 06:53:33,1.0.2
2a14295e-4589-468b-a704-448e9b040386,Jagadish K,"Unable to login. I get an OTP and as soon as I enter, it says otp expired.",1,10,1.0.4(17),2021-12-03 12:39:59,1.0.4(17)
1d7a8494-11a2-4d6f-8980-18f3c0bd9f26,Guruprasadh K Sundaramoorthy,"Don't fall for bait. The outlets are lazy to give back the change after updating the points. One outlet near Velacherry, Chennai, asked to use debit card for petrol as if they are going to wave the hidden charges like surcharges. Ridiculous. They have to overcome laziness and provide proper change to the customer. I may stop using shell if this attitude continues.",1,23,1.0.5(18),2022-01-25 08:33:21,1.0.5(18)
ff79e19b-1c77-4633-ad02-b626b1c172cf,Saran S,Every time when there is an update the accumulated points will become zero. This happened to me thrice.... pure cheating...,1,0,1.0.6,2022-07-03 10:21:17,1.0.6
93f9d407-6b30-4ba4-a59c-f43068d09d09,Eny Klik,Why must have 2 apps? Why dont u merge blink apps and shell apps. It will be more convenient.,1,0,,2023-08-20 10:49:07,
a221efb6-cacd-4841-abdd-2974d004d208,Surya Chiru,It's worst. When ever u open the app it shows no internet. There is no use of thes points.,1,0,1.0.2,2021-06-28 09:16:11,1.0.2
417166a9-733e-4efc-829c-38c2da665942,Fendy Sepueroe,"Try to download, open apps, register my 2 wheels card number, success, then there are menu for next regsiter my 4 wheels card (i would like to register both my 2 wheels and 4 wheels card). I have bigger point for my 4 wheels card",1,0,1.0.5(18),2022-01-31 14:07:35,1.0.5(18)
76d1ed43-a5a6-41b7-8a60-aa0573e93046,Nagabhushan S,"App very poorly developed. After clicking on register and entering phone number, it doesn't proceed further to generate OTP..",1,36,1.0.1,2021-01-13 20:20:53,1.0.1
66b27b71-4707-4692-baca-51979be595f0,Yessa Santoso,Suddenly signout. Can't input the otp when sign out. Bad user experience!,1,6,1.0.7,2022-11-27 09:36:13,1.0.7
325a3200-482c-45fb-b7ed-a362ec8d2684,JJ Wong,How do you actaully redeem in this lousy app?,1,0,1.2.1,2024-03-10 23:52:27,1.2.1
9cbba214-4a6c-4c94-b101-4c60a18a9893,Hrishikesh.C.E Wyler,"Hello, I am a regular user of this app. Why can't you add the basic thing like current fuel price in this?? This is very necessary know..",1,0,,2022-11-15 20:44:49,
fd0df700-a1cc-47c5-9f1b-e61a685ef70d,Rupesh Sharma,Not getting OTP after reinstalling the app. Tried n no. time but its not working,1,0,1.0.5(18),2022-05-24 20:27:09,1.0.5(18)
71755f41-cc01-4697-92a7-5e341d068156,Johan Minhat,Tolol.. minimum rm10..moto xleh guna apps ngok ni,1,0,1.2.1,2024-02-08 22:50:26,1.2.1
96be4d42-f2f3-481d-b524-afaab75f4b27,DanieL GiandA,Why since update newest app in app store dissapear the oldest data account..can't sign in too..purchase point is gone..why..why..why..,1,5,1.0.7,2022-11-22 20:45:16,1.0.7
d116d574-6427-43a5-b8b9-7a45345a30aa,Mr. Anil kumar,"I've download the app but it is showing No Internet Connection, but my internet is working fine.",1,4,1.0.2,2021-07-15 10:04:26,1.0.2
3c282d6e-e257-4094-8666-01b0cf31e5d5,Abdul Kareem,Very very bad customer service lots of times I called on customer care but no responses..,1,0,1.0.1,2021-03-12 16:22:28,1.0.1
e2e28961-2da7-4a66-a42f-42c6dcc7d2da,mathi vaanan,The app does not allow to key in the OTP details once reset PIN. PIN receive via SMS.,1,0,1.1.1,2023-08-21 16:08:28,1.1.1
1c93827a-2bc1-4c05-8881-a86084e9c484,Narendran vn,Cannot register. Stuck in the state and city option. No option available,1,0,1.0.1,2021-02-06 20:03:23,1.0.1
74035571-8ab6-40fe-8c71-b825cf936616,SivaBalan Kumaravel,In my infinix note 10 pro it's not generating QR code. So I couldn't use it at fuel stations.,1,0,1.0.6,2022-06-23 17:07:34,1.0.6
0ef828ab-9d5b-45d1-a358-607a086ee518,RG Mocktails,"First work on this app, unable to register & not getting pop-up option properly to get register.",1,1,1.0.1,2021-01-14 18:05:06,1.0.1
4272c7ce-3add-4949-a018-3eb7db1d43df,Santosh Hemashekar,Not able to select state and city. So unable to complete registration.,1,13,1.0.1,2020-12-30 17:49:52,1.0.1
a504549f-2685-4a5c-b62a-99f9eeb213dd,Sadath,Doesn't work properly. Expected the app to be of high standard similar to the fuel at Shell.,1,4,,2020-12-19 14:27:09,
13f3230a-c3f9-4f55-881e-4fb64f51787d,Michael Tjandra,"Logged out from my account after update, can't log back in and just lost my account. 🖕🏻",1,0,,2022-11-28 17:14:07,
a948af3b-abcb-436d-aa33-3f8d60e80391,Dr. NAVEEN KUMAR M S,"Its worst rewarding prgm. If you want to waste, your phone memory download it.",1,0,1.0.5(18),2022-05-22 17:03:46,1.0.5(18)
87dadccf-6c6a-4b58-b159-4942f269a43c,Diana Ahmad,Unable to register ..button disabke and prompting to select a country but country field not visible.,1,0,,2023-02-17 06:13:33,
f0471d49-db7c-4ee2-b17d-f3db934a9270,Bhavesh Lakhisarani,I can't login after update. I get OTP but when type it in and it says OTP expired,1,2,1.0.4(17),2021-12-03 12:44:08,1.0.4(17)
1eee57fd-0b68-4df1-8efb-0808384ee39b,Saran kumar,Waste. . . My mobile having excellent internet connection but it says no internet connection after open the app. . Points not reflected,1,0,1.0.1,2021-01-27 09:25:45,1.0.1
45e4ccfc-fc83-4f0e-8dde-1e02177508c6,Lim TL,Does not work for my samsung S23 Ultra..cannot register or login. Thus cannot claim points when I pump at Shell.,1,2,1.0.8,2023-05-08 08:54:51,1.0.8
d490d8c7-94e7-43f1-a70c-6dabc46c76bf,ajaykumar ajaykumar,Very worst app its asked update I agreed and accepted but it's downloading from 2 days but not updated old application is best from these newer application,1,0,1.0.3,2021-12-03 07:48:35,1.0.3
677a931d-bb20-4381-a9d9-fe6eca5e1f67,Reza Agus Pratama,Not receive an OTP after updating the apps since weeks. Please fix it,1,2,1.0.7,2022-12-06 02:04:14,1.0.7
1bc9a280-af8d-48f0-b24f-f586cd952bbe,Chirag Vaishnav,App does not work after entering number it's not working at all not receiving otp,1,0,1.0.1,2021-02-11 11:39:00,1.0.1
7e69e8cc-5547-4da7-83a3-4ee84d98d574,Vinod Ak,Immediate redeem option not available for fuel filling. Your staff is not always adding the points .,1,1,1.0.6,2022-06-01 18:03:12,1.0.6
05508dae-13e2-455e-8b4e-c9ada5a15a7a,Viola Deskawati,"The application can't be open. I check the newest version, I already use the newest.",1,0,1.0.6,2022-06-21 12:36:04,1.0.6
e8968969-7a4a-4e6b-9ceb-b127e1a28c4e,ade stefanus,"Bug after update. Can't login, can't select county.",1,6,1.0.7,2022-12-01 07:46:54,1.0.7
8f01bbad-2af3-4fb0-9369-f3000b956e6a,Siva B,We are not even getting OTP for new user sign up.. Didn't expect these kind of issue in a reputed brand like SHELL!!!,1,0,1.0.6,2022-08-13 07:43:37,1.0.6
61dbc060-ce30-4e7d-b54d-90a707000676,Manju B M,Now a days this app is not working properly..it not showing transaction details and not adding points ... waste app don't download this app,1,6,1.0.3,2021-10-27 15:58:19,1.0.3
83a53674-3bec-42c2-8373-5c3d2e19d80a,chandan chandan,Not able to login or register because no OTP is coming to mobile numbers even after multiple tries,1,0,1.0.6,2022-09-11 19:56:10,1.0.6
f4775ac9-0fe7-4495-bd4a-35411db2f370,Varun Ananthan,Not receiving otp eversince and unable to register. Already feeling pathetic about the app.,1,0,1.0.2,2021-04-09 23:16:08,1.0.2
8b2ef0cd-5459-4ed1-a161-0b473896ef0f,Vinodh Kumar,App installed but Unable to select the city or state option.... it's not coming,1,0,1.0.1,2021-02-26 21:19:43,1.0.1
51568973-598f-4f2e-a4c3-73d704ab5667,Neneng Suryani,"Cannot register. Been trying to register several times, but the OTPs weren't sent",1,0,1.0.5(18),2022-03-08 18:13:53,1.0.5(18)
f442adfa-cf59-41f7-9abb-0ae9e3b2457d,Adi Keren,app very slow... can't connect my ClubSmart card and ask CS for help also not working...,1,1,1.0.8,2023-04-27 10:05:20,1.0.8
8823c86e-c8d9-4921-aed9-d774d55f1611,Tony Chandra,Bad apps can not link my shell clubsmart card to this apps. Wasting my time.,1,0,1.0.5(18),2022-02-07 18:27:35,1.0.5(18)
3fe93471-345c-4dcb-af68-32fca6b32a7b,Jesus String,Always need to enter OTP and OTP takes hours to receive and now currently unable to login due to OTP timeout.,1,0,,2022-12-10 23:14:20,
01123810-fdb4-4ed5-b20d-d747a2f84909,yuda prasetiya,"Cannot find card, don't force people to switch if your system didn't ready!!",1,0,1.0.5(18),2022-03-06 13:08:59,1.0.5(18)
9796fe6b-f44d-485f-9900-d383dd8d5dd1,Sridhar Keshava,"Worst ever experience from such a great petrol company ,that means Sheel doesn't need a feed back rather it only needs Indian currency ,repair the app .",1,0,1.0.5(18),2022-02-05 04:21:22,1.0.5(18)
f6f7b9fd-8b51-4e0d-a830-702d508b8098,Selva G,Worst app many times I went to bunk and poured petrol for my bike no credits added now the app showing your account is terminated wonderful,1,0,1.0.1,2021-05-28 22:14:49,1.0.1
7248fb17-897b-478a-b31e-319b1bdb1b5c,Rofiil Honi,after sign out and then sign in again cant login to my account it said the number is not registered but i got the otp,1,2,1.0.7,2023-01-04 16:01:17,1.0.7
11ab16ff-5075-4dd3-83b3-1386cfc61453,SARATH HOLIGI,Stuck in the registration flow. Not able to fill state and city fields and proceed,1,14,1.0.1,2020-12-25 21:32:57,1.0.1
671b889d-1492-48c0-9d6c-90f4853e19ce,Photos Engagement,"Points won't add after refueling. Need to wait for several days. if u ask ppl at fuel station thel'll tell ""we scanned server is busy points ll come"".",1,2,1.0.1,2021-02-06 15:13:47,1.0.1
ecb5a024-6719-4c84-a8a5-d50078d9594a,Rai Hadou,Can only add rider card or car card. Cant add both card. Useless app for now,1,0,1.0.7,2022-12-01 14:26:20,1.0.7
1989da9b-ad87-4c62-b81d-1a541d111834,Ardios Gunawan,"Can't register.. almost 6 days, no improvement. Uninstall",1,2,1.0.7,2023-01-04 07:56:40,1.0.7
a53d433b-2dd9-4dd1-93fb-84ab8420181d,sanketh naik,"QR not showing,and because of that points are not credited to my number 😀.well 👍nice trick.",1,0,,2022-05-22 21:57:12,
00e3f037-6fef-4e3d-afff-db97a2b30821,NOOR ULLA,unable to sign in or register the shell dealers pump station team always give excuses need help please otp issue app shows otp sent to registered number bot single time recived otp,1,0,1.0.5(18),2022-05-13 01:24:42,1.0.5(18)
ad58e2f0-ed57-449f-b869-4ee46fbc1ec8,Ismail H.,"After the update, i Can't open the app, keep closing.",1,1,1.0.6,2022-05-27 11:40:42,1.0.6
7e4d226b-0772-4dfc-80b0-2dbacbe6c482,Sharat Embrandiri,Card QR code not getting generated. Old point balance lost on app reinstallation.,1,0,1.0.5(18),2022-06-01 15:49:17,1.0.5(18)
a5861539-b78e-4e63-aabc-8b075a77793a,kssshetty21,Unable to register the details itself. Shell outlet staff is not ready to help for th issue.,1,11,1.0.1,2020-12-25 13:13:39,1.0.1
6148415e-7750-40de-b06c-246ff694a8e9,avanish,It doesn't log in or register either.....you need to fix this app..... didn't expect this from shell,1,16,1.0.1,2021-01-01 04:41:02,1.0.1
3e55a64b-98d5-40d3-a0aa-c89532729012,Swapnil Shinde,Bad experience 1.OTP problem 2. state and district options hav problem to fill information.,1,2,1.0.1,2021-02-21 08:38:45,1.0.1
9f63404c-526f-481b-93a3-743714954261,Bhautik Brahmbhatt,Point not add after take petrol only mobile no collected not update in app two times.,1,0,1.0.2,2021-04-22 11:18:50,1.0.2
85632a11-4c1e-4617-8c78-02a8f28e67b3,Sachin Ak,"Unable to login. keep saying no intermet connection, when im having one",1,0,1.0.2,2021-04-19 04:24:49,1.0.2
57d4e4e3-9432-4702-8ee9-7e6cf138cc09,sarief Hidayat,Useless Redeem point. Bad sync apps with operator computer. So icnt gt my hat reward aftr Redeem 300 point until exp. Specialy at Cilegon gas station.,1,0,,2022-07-23 10:04:28,
b2528f24-31ee-427a-9888-9347830b7688,Harry She,Couldn't receive otp after multiple attempts. Android user,1,2,1.0.7,2022-12-28 16:41:44,1.0.7
62bbb7c4-77db-46fd-9af3-7da0cc1677b1,Karlina Wulan Adlianty,"Can't register at all, OTP always expired when I input the code😮‍💨 useless",1,0,1.0.7,2023-04-14 20:27:25,1.0.7
74907caa-5306-4b40-8830-a6f562d7adfd,Srini Vas,"Very bad, not able to login and no generation of otp number",1,0,1.0.1,2021-03-07 12:28:40,1.0.1
f9e74480-1f3d-4c7b-8311-6644c0290fa3,Bobby Adhitya Nugraha,"Accidentally log out account, and cannot log in any more, it said phone number not registered",1,1,1.0.7,2023-01-04 13:02:40,1.0.7
612c420c-cfa1-453e-824f-b01ea580e36e,Yichuan Kerh,Cant even login when no OTP can be received despite multiple resend request made,1,6,1.0.7,2022-11-24 06:53:02,1.0.7
